{
  "record_type": "aggregate",
  "metadata": {
    "benchmark_version": "1.0.0",
    "schema_version": "1.0.0",
    "experiment": {
      "id": "dictator",
      "family": "strategic_game",
      "manifest_version": "1.0.0",
      "parameters": {
        "pool_amounts": [
          10,
          100,
          1000
        ],
        "repetitions_per_condition": 10
      }
    },
    "model": {
      "id": "gpt-4o",
      "provider": "openai",
      "api_model_id": "gpt-4o-2024-11-20",
      "parameters": {
        "requested_temperature": 0.5,
        "effective_temperature": 0.5,
        "max_output_tokens": 8192,
        "requested_reasoning_mode": "provider_default",
        "effective_reasoning_mode": null,
        "seed": null,
        "system_prompt": null,
        "tools_enabled": false,
        "provider_options": {}
      }
    },
    "protocol": {
      "condition_order": "manifest_order",
      "local_random_seed": 20260811,
      "response_parsers": [
        "parse_dollar_amount"
      ],
      "transport_retry_policy": {
        "maximum_retries": 2,
        "backoff_seconds": [
          2,
          4
        ],
        "retry_only_before_completion": true
      },
      "invalid_response_policy": {
        "silent_imputation_allowed": false,
        "include_invalid_trials_in_metrics": false,
        "maximum_experiment_invalid_rate": 0.05,
        "minimum_condition_valid_rate": 0.8,
        "failed_bisection_step_invalidates_sequence": true,
        "failed_release_run_action": "rerun_full_model_experiment_with_new_run_id"
      }
    },
    "run": {
      "id": "fixture-dictator-gpt-4o-001",
      "started_at": "2026-08-11T14:00:00.000000Z",
      "completed_at": "2026-08-11T14:05:00.000000Z",
      "status": "completed",
      "attempt": 1
    },
    "provenance": {
      "capture_method": "native",
      "completeness": "complete",
      "code_revision": "39ebab50278dfdba1aed157364981d5b33a245b0",
      "repository_dirty": false,
      "runner": "src/tasks/dictator.py",
      "python_version": "3.11.9",
      "platform": "Linux-x86_64",
      "missing_fields": [],
      "source_paths": []
    }
  },
  "trial": null,
  "aggregate_metrics": {
    "sample": {
      "observed_trials": 10,
      "valid_trials": 10,
      "invalid_response_trials": 0,
      "provider_error_trials": 0,
      "interrupted_trials": 0,
      "valid_rate": 1,
      "invalid_response_rate": 0
    },
    "overall_mean_transfer_share": 0.4,
    "by_pool": [
      {
        "condition_id": "pool-100",
        "pool_amount": 100,
        "mean_transfer_amount": 40,
        "mean_transfer_share": 0.4,
        "valid_trials": 10
      }
    ]
  }
}
